action_id	lane	surface	finding	evidence	decision	implementation_target	validation	risk_level	status
P3-A001	documentation	README/docs/OpenSpec	Split workflow boundaries must remain the current documented contract	README.md; docs/ONBOARDING_GUIDE.md; p2 implementation notes	accepted	README.md; docs/ONBOARDING_GUIDE.md; docs/TECHNICAL_LAB_NOTEBOOK.md; p3 synthesis	PYTHONPATH=src /Users/ncamarda/mambaforge/envs/eq-mac/bin/python -m eq run-config --config configs/glomeruli_candidate_comparison.yaml --dry-run	medium	done
P3-A002	documentation	docs/PIPELINE_INTEGRATION_PLAN.md	Historical planning doc contains stale command examples that documentation-wizard flags as live drift	documentation-wizard-report.md finding docs/PIPELINE_INTEGRATION_PLAN.md:155	accepted	docs/PIPELINE_INTEGRATION_PLAN.md; docs/README.md	python3 scripts/check_openspec_explicitness.py openspec/changes/p3-repo-wide-quality-review-and-streamlining	low	done
P3-A003	workspace	repo/runtime/cloud layout	Workspace-governor reports repo is already in expected source root and has no rewrite candidates	workspace-governor-report.md	accepted	no workspace move; keep roots documented	workspace-governor-report.md plus final git status	low	done
P3-A004	implementation	workflow dispatch	Retired mixed workflow names must remain rejected and downstream workflows must fail closed	p2 tests and src/eq/run_config.py	accepted	src/eq/run_config.py; tests/integration/test_cli.py	/Users/ncamarda/mambaforge/envs/eq-mac/bin/python -m pytest -q tests/integration/test_cli.py	high	done
P3-A005	research	negative crop supervision	No supported true-negative glomeruli crop annotations currently exist; retraining alone should not be expected to fix false positives	p1 source-provenance-inventory.md; p0 audit-results.md	deferred	follow-on negative-crop curation and sampler implementation spec	follow-on tests for manifest validation and sampler provenance	high	deferred
P3-A006	validation	candidate comparison runtime	Workspace-governor asks what smoke command defines success; user requested a full quick run with about 5 epochs per run	user request; workspace-governor-report.md	accepted	quicktest_glomeruli_candidate_comparison_5epoch.yaml	env PYTORCH_ENABLE_MPS_FALLBACK=1 MPLCONFIGDIR=/tmp/mpl_eq PYTHONPATH=src /Users/ncamarda/mambaforge/envs/eq-mac/bin/python -m eq run-config --config openspec/changes/p3-repo-wide-quality-review-and-streamlining/review/quicktest_glomeruli_candidate_comparison_5epoch.yaml	high	done
P3-A007	validation	repo test suite	Final validation must include full pytest and OpenSpec validation	p3 tasks 6.1-6.8	accepted	repo test suite; OpenSpec validators	/Users/ncamarda/mambaforge/envs/eq-mac/bin/python -m pytest -q	high	done
